,288,yomi-the-fashionista,"yomi the fashionista","Winner of the Lagos GT Bank fashion week.",Male,"hair: covered;  eyes: white;  teeth: white clothing;  wrapper across one shoulder accessories: cap expression;  shocked strength: hard-worker weakness",16d256ba-dc4e-4559-ae41-59779f351ad3,ee0fbdf5f73c1245cc82f99c1bb6ed94303d34b2612d0e4741afe1aea83acdb5
,289,ibu-the-importer,"ibu the importer","A rich man who steps on people's toes",Male,"hair: covered;  eyes: light blue;  teeth: white and a gold tooth;  clothing: isi-agu;  accessories: cap expression;  straight-face strength: wealth weakness",d3edc876-3f2f-4699-a376-0787bb06c5d5,786bd35ec20834b8ed45233b50e7e698585b853ae262dd57a9cebfa26f99fbb5
,290,massa-the-ghanian,"massa the ghanian","A rich trader who loves giving back to the community",Male,"hair: covered;  eyes: closed;  teeth: white;  clothing: akan;  accessories: cap;  expression: happy strength;  wealth weakness: irrational",9a9a5fbd-7a3c-469c-95f2-50303c2e9fc8,3112c79ad7e7b48c71079817f38e48d4ce5a79df9868ae5c177b0f4b7ab091aa
,291,james-the-musician,"james the musician","A Nigerian based musician who host shows",Male,"hair: brown;  eyes: closed;  teeth: white;  clothing: akan;  accessories: none;  expression: happy;  strength: good voice;  weakness: womanizer",0d4ad447-3836-47cd-8387-066b200cda01,689c168974057e1579c70bce2add1ba26546a36dd9ad2183b964f04fb036376a
,292,gbenga-titled-man,"gbenga titled man","A chief who is very ambitious in his pursuits for fame",Male,"hair: covered;  eyes: light blue;  teeth: white with a gold tooth;  clothing: akan;  accessories: none;  expression: emotional;  strength: friendly;  weakness: deceitful",dc6c1a39-ec78-44ca-8296-68c6de7b5de4,c022ef7d742c0b75e8896c43ebd4ba75adb43bca4df1c10a266f09e5d5832e13
,293,abaga-the-rapper,"abaga the rapper","A flashy millionaire and a music rapper",Male,"hair: covered; eyes: closed;  teeth: white;  clothing: dongri and yellow t-shirt;  accessories: cap;  expression: happy;  strength: wealth;  weakness: recklessness",c428411c-5a06-4b74-bd17-e53b76f9fc6c,18f1d7c8d9d7188abf8925343d59decde55373ed064b0cc6bb147c2ed4c1de08
,294,izuchukwu-the-fisherman,"izuchukwu the fisherman","A fisherman who knows how to paddle well",Male,"hair: covered;  eyes: closed;  teeth: white with a gap tooth;  clothing: green shirt;  accessories: cap;  expression: dozzy;  strength: great body-build;  weakness: drunkard",15e1caf2-06b3-45d8-9b35-f95965b64e34,15828f0acdb7b2972bf5e1b42865d2666d85f59eeb2d3e0f073d618989344a0f
,295,mark-the-philanthropist,"mark the philanthropist","A London based philantropist.",Male,"hair: brown;  eyes: white;  teeth: closed;  clothing: white and blue shirt;  accessories: none;  expression: irritated;  strength: philanthropist;  weakness: anger issues",b48cbd98-96c2-4ec4-9d17-2c798be5b90f,5c09d7f2fa552007c072c464a01ef8597afcf9174c99d14e94f93898bc105642
,296,desmond-the-politician,"desmond the politician","A young politician who just became a minister",Male,"hair: covered;  eyes: grey;  teeth: closed;  clothing: yellow and purple agbada;  accessories: ila;  expression: smirk;  strength: team player;  weakness: deceitful",c52d4fbb-622b-4e2b-85a9-1a1d0f3d97d6,acb221abdb85bd2a9c296a9922444175263fd790baee739cac56482f634a6353
,297,okoro-the-bachelor,"okoro the bachelor","A local palm wine tapper with hopes and dreams",Male,"hair: covered;  eyes: grey;  teeth: white and a gold tooth;  clothing: wrapper across one shoulder;  accessories: cap;  expression: pretense;  strength: motivated;  weakness: poor",e441439d-49a3-41eb-bf9d-3c7f98c268bf,6d769a60a44f0af42b87a8d0a5a11a1619c71a4bf9c4507d2ff5ec73a3bac582
,298,saro-the-clothemaker,"saro the clothemaker","The yoruba man that stole the king's wife.",Male,"hair: covered;  eyes: grey;  teeth: white;  clothing: red and yellow agbada;  accessories: cap;  expression: straight face;  strength: good-looking;  weakness: womanizer",7e10af4e-1252-4f96-83a8-78411e152bae,f6c6742d586441fa598bb9b8d407761f2189bb18377be1a0fffb385584e30bb0
,299,kalu-the-ichie,"kalu the ichie","A man of wealth with afluence spreading all over the east",Male,"hair: covered;  eyes: sky-blue;  teeth: white;  clothing: orange plain and pattern shirt;  accessories: cap;  expression: happy;  strength: wealth;  weakness: pride",482ab247-73a4-4ff8-9172-732f3d0729b8,04e5469ca989769b1fec22bdd9e27955e711abc8a5cc0f5fa3de95b665d2a09e
,300,tamuno-the-prince,"tamuno the prince","An Ijaw prince who is also the heir to the throne",Male,"hair: covered;  eyes: sky-blue;  teeth: closed;  clothing: akan;   accessories: cap;  expression: straight-face;  strength: caring;  weakness: easily deceived",108447d1-f2d5-4816-8ebb-599286c3fabf,3b5b7ee049fd213807962cce7568a1eb04d6ebf86190e6114d58933d84e51110
"TEAM SCALE",301,"wendy-the -banker","wendy the  banker","Wendy loves working in the bank, as she gets to meet different people.",Female,"hair: dark red;  eyes: blue;  teeth:none;  clothing: blue and yellow ankara;  accessories: none;  expression: shocked;  strength: none;  weakness: none ",587645e2-5ace-11ed-9b6a-0242ac120002,4fa55db0f47aa6e9f649caedad47eba80f880910855a7550b58c8498d4abc064
,302,"uduak-the -dark horse","uduak the dark horse","Uduak looks innocent and has the whole apartment bugged",Female,"hair: brown;  eyes: blue;  teeth:none;  clothing: multi-colored ankara;  accessories: none;  expression: witty;  strength: none;  weakness: none ",58764862-5ace-11ed-9b6a-0242ac120002,991a15a7ae477668aa27b1a4e9b72c8dfb3cf37c94651306ec3c425afbeef404
,303,"timeyin-the -eccentic","timeyin the eccentic","Timeyin is as eccentric as they come with no care for others opinions",Female,"hair: brown;  eyes: blue;  teeth:none;  clothing: multi-colored ankara;  accessories: smoking pipe;  expression: high;  strength: none;  weakness: none ",58764a2e-5ace-11ed-9b6a-0242ac120002,af111a9b2b5d9018b4d614aa7ca51333d3c5dec325d2761fb349610635daf5db
,304,"omawunmi-the -businesswoman","omawunmi the businesswoman","Omawunmi is a no-nonsense woman with a shop in idumota",Female,"hair: pink;  eyes: blue;  teeth: white teeth;  clothing: yellow ankara;  accessories: none;  expression: angry;  strength: none;  weakness: none ",58764b78-5ace-11ed-9b6a-0242ac120002,78a3b371e1f6c9a6dd2b09f41e82bf45b64672190f72635fd7f3d32cfc4fcd84
,305,halima-the-housewife,"halima the housewife","Halima loves to bake and cook for her children",Female,"hair: brown;  eyes: blue;  teeth: none;  clothing: ankara designed with yellow red and green;  accessories: none;  expression: tired;  strength: none;  weakness: none ",58764d8a-5ace-11ed-9b6a-0242ac120002,ccd0a87e391a5736df66c5e5029261c3efb657c198b63f1ab33e01264c81c668
,306,"muna-the -block sister","muna the block sister","Muna loves to tell everyone in the block about her younger escapades",Female,"hair: black;  eyes: blue;  teeth: none;  clothing: wolf skin ankara;  accessories: headgear;  expression: shocked;  strength: none;  weakness: none ",58764ea2-5ace-11ed-9b6a-0242ac120002,a774a27b5c9e86f912fc4d262eb4d8013104c4ed2178c935f9df8b22550b5fa3
,307,"stella-the -gossip","stella the gossip","Nobody gossips on the block like stella when smoking.",Female,"hair: red;  eyes: covered eyes;  teeth: none;  clothing: black ankara with bright design;  accessories: none;  expression: calm;  strength: none;  weakness: none ",58764fd8-5ace-11ed-9b6a-0242ac120002,3c8f6da6547426c57e5f7b6780d0e6960af8457560cc785c9e3b99d30268dc8b
,308,agbani-the-wannabe,"agbani the wannabe","Agbani loves to shop antique decorations for her mansion in Idi-Iroko.",Female,"hair: purple hair;  eyes: covered eyes;  teeth: none;  clothing: blue one-armed dress;  accessories: none;  expression: happy;  strength: none;  weakness: none ",5876542e-5ace-11ed-9b6a-0242ac120002,92f4cc727af96a0b5742aff26acc709570d52bf30639f137b55d5cbdc7131ca2
,309,"asante-the -warrior","asante the warrior","Asante came from a long line of warriors in Ghana.",Female,"hair: pink braids;  eyes: covered eyes;  teeth: none;  clothing: one-armed brightly colored dress;  accessories: none;  expression: calm;  strength: none;  weakness: none ",58765578-5ace-11ed-9b6a-0242ac120002,b6f7ccbd37864137be7692f2ca6c19311e26db494484b89c8a7feecedce60c19
,310,"hilda-the -insomaniac","hilda the insomaniac","Hilda prefers to sleep during the day.",Female,"hair: pink;  eyes: covered eyes;  teeth: none;  clothing: multi colored ankara;  accessories: none;  expression:calm;  strength: none;  weakness: none",5876569a-5ace-11ed-9b6a-0242ac120002,7c320c7f7ea9d39810ab27f0ad23cd477b574e55b528fb1274c2eb3ca7ef7eb5
,311,"sisi yemi-the -street aunty","sisi yemi the street aunty","Sisi Yemi is everyone's favourite street aunty.",Female,"hair: dark brown;  eyes: brown eyes;  teeth: none;  clothing: blue and yellow ankara;  accessories: none;  expression: shocked;  strength: none;  weakness: none ",587657a8-5ace-11ed-9b6a-0242ac120002,1ceda8ae61b6545b12f4db3dede210eb4546ff7f60dd939e57f0ec413a4c48a2
,312,"chiamaka-the -bully","chiamaka the bully","Chiamaka hates people in her business and likes to scare the kids on the block.",Female,"hair: pink;  eyes: brown;  teeth: none;  clothing: multi-colored ankara;  accessories: smoking pipe;  expression: strong;  strength: none;  weakness: none ",587658ca-5ace-11ed-9b6a-0242ac120002,f25de5d3fa6b88b1775303c16a943dd4dbafa44bf887a5f8000782fac56a9ca0
,313,gift-the-fashionista,"gift the fashionista","Gift has always been bold and that spreads to her fashion sense too.",Female,"hair: brown;  eyes: brown;  teeth :none;  clothing: multi-colored ankara;  accessories: none;  expression: witty;  strength: none;  weakness: none ",58765adc-5ace-11ed-9b6a-0242ac120002,2c4f3ee73dd07065aefccb314be7478d3fb6bf6bfcdf4ca8d66ea85422bf65de
,314,omoyene-the-weirdo,"omoyene the weirdo","Omoyene likes to murmur to herself and talks about seeing ghosts.",Female,"hair: brown;  eyes: brown;  teeth: none;  clothing: yellow ankara;  accessories: none;  expression: calm;  strength: none;  weakness: none ",58765bea-5ace-11ed-9b6a-0242ac120002,3a9b497f0d00c42aa822743452be83d04f7572b160b546714bb79992dd9a87e7
,315,"maria-the -freshface","maria the freshface","Maria likes to believe the world is sunshine and rainbows while blowing gum.",Female,"hair: pink;  eyes: brown eyes;  teeth: white teeth;  clothing: yellow green and red ankara;  accessories: none;  expression: furious;  strength: none;  weakness: none ",58765d02-5ace-11ed-9b6a-0242ac120002,1ec48f4af76d166254518bc3321520ac511bc5ac786651758d0e642a92e4c804
,316,"monica-the -smoker","monica the smoker","Monica is never found without a pipe and loves to interject in every conversation.",Female,"hair: grey;  eyes: covered eyes;  teeth: none;  clothing: black ankara with bright designs;  accessories: yellow glasses;  expression: hip;  strength: none;  weakness: none ",58765e24-5ace-11ed-9b6a-0242ac120002,e602a80f2b5a696a85c394d3ad7c59d5fabe1c5dc2fd649fd03c2704e5ac83d4
,317,"janet -is always -found singing ","janet the singer","Janet is always found singing in whatever activity shes doing.",Female,"hair: purple;  eyes: covered eyes;  teeth: none;  clothing: yellow and blue ankara;  accessories: yellow glasses;  expression: cool;  strength: none;  weakness: none ",cef902bc-5afc-11ed-9b6a-0242ac120002,02cf14557f8f824a3e9b4c8145afb7a61c2b11704b08c6b5c94a1ebdf3a2330c
,318,emi-the-reggae-girl,"emi the reggae girl","EMi is a beautiful dancer; she rules the reggae world.",Female,"hair:pink braids;  eyes: covered eyes;  teeth: none;  clothing: multicolored ankara;  accessories: yellow glasses;  expression: happy;  strength: none;  weakness: none ",cef9060e-5afc-11ed-9b6a-0242ac120002,e92da9cfef65f8bf96e28d6640af9cdce0545e895910db883857c6e1f7cae423
,319,aisha-love-the-life-of-the-party,"aisha love the life of the party","Aisha always party during the weekend.",Female,"hair: red;  eyes: covered eyes;  teeth: none;  clothing: wolf skin ankara;  accessories: yellow glasses;  expression: hip;  strength: none;  weakness: none ",cef907a8-5afc-11ed-9b6a-0242ac120002,08a5216f7acd1c4b5c6e92484020f29aba02d391c19e9409525e941ccc9cd6fb
,320,amaka-the-tailor,"amaka the tailor","She sews the most beautiful dress in the hood.",Female,"hair:grey;  eyes: covered eyes;  teeth: none;  clothing: black dress;  accessories: yellow glasses;  expression: happy;  strength: none;  weakness: none ",cef9091a-5afc-11ed-9b6a-0242ac120002,57097f5a656132e37fe9c172c7b49b7ecf11e29e97cd224815aee28b61f04611
"TEAM SANDPAPER",321,omunyinyi-the-stoic,"omunyinyi the stoic","Omunyinyi wears a Kitenge coat.",Male,"hair: bald;  eyes: teary;  teeth: none;  clothing: checked ankara;  accessories: none;  expression: teary;  strength: powerful;  weakness: self-loathing",c2d6a3ac-1d4d-4268-ba7f-4f0f8f50c1ab,222c95359f2f300b2c2849b264a1ecdbaeab1ee479994e0c1dece3f6d3ed3158
,322,kamau-the-sleeper,"kamau the sleeper","Kamau has his eyes closed as he meditates.",Male,"hair: blad;  eyes: closed;  teeth:  none;   clothing: black ankara;  accessories: none;  expression: flat;  strength: open to suggestion;  weakness: always sleepy",20330f5c-40c2-4f6a-b9d8-d1d04fb97daf,ce76d043b1386a37172fd5bb218bde9462d26b3d28aa7ac2f12e63019cabd50b
,323,mutiso-the-lastborn,"mutiso the lastborn","Mutiso is masked up but dozes off while waiting for food. ",Male,"hair:bald;  eyes: closed;  teeth: none;   clothing: yellow ankara;  accessories: none;   expression: tired;  strength: consistency;  weakness: pessismist",0706c338-42eb-4d26-84ea-c24b39628200,edbccca6f3ccc6113cd4d7b85df69e30f30aa41474d3bba2e715af2be9c1207f
,324,omondi-the-vegeterian,"omondi the vegeterian","Omondi wears a green coat with lots of patterns. ",Male,"hair:bald;  eyes: sharp eyed;  teeth: none;   clothing: green ankara;  accessories: none;  expression: alert strength;  leader weakness: anxious",bfb5e8d5-d7a7-4aa8-85e8-d7d9afd4adb3,f302572c9505615c0c25a4ae5915689a0d5c5ad1d359f4a4314909551e6286dd
,325,barasa-the-optimist,"barasa the optimist","Barasa looks up to the sky and makes a wish.",Male,"hair: bald;  eyes: blue teeth;  none skin: dark skin clothing;  brown ankara accessories:none expression;  awake strength: strong willed weakness",2da4bef4-38cc-4414-99ad-7361fac04b2b,fccaf0fd860d4cc395a823d8a7d9d9ecae1b8da5eff5616adfbb416d443946ad
,326,mwembu-the-elder,"mwembu the elder","Mwembu is old but not so old and yellow is his favorite color.",Male,"hair: bald;  eyes: black teeth;  none skin: dark skin clothing;  dark ankara accessories: none  expression;  plain strength: fulfilled weakness",36181230-6ac9-417f-af5c-23bdd2c25ecb,2746ec35e05717b708abbdf190a6bcb55c71f34364d02b87e2e94afb0f978f2c
,327,mbogi-the-fighter,"mbogi the fighter","Mbogi is captured and forced to wear a mask. ",Male,"hair: bald; eyes:  blackteeth;  noneskin: darkskin clothing;  onesideankara accessories: noneexpression;  willfull strength: fighter  weakness",3a7bc3c4-1463-42ce-84c9-07337da64435,d4612301b79ca488eeb187813a930ab0691597ae3e26388c8bef8b236afd0722
,328,mrosho-the-runner,"mrosho the runner","Mrosho has his mask on and yet still runs his race. ",Male,"hair: bald;  eyes: sea blue teeth;  none skin: darkskin clothing;  purple ankara accessories: none expression;  alert  strength: visionary  weakness",b2ca2c76-3b6d-43f1-8cc9-089b6ab83876,799da6a76542b80fa317b0a1bd6996a5295086644f94a6d6dd1c8d734675be74
,329,milele-the-african,"milele the african","Milele wears a dress with a nice african print in orange.",Male,"hair: bald;  eyes: blue teeth;  none skin: dark skin clothing;  orange ankara accessories: none expression;  timid strength: leader weakness",644b0259-d75c-456d-934c-ce7c052bad3a,2fcc3f5a4b953849a29ae1ce78ee10d1ad7406aa7bd4ca42750e22d82ce33f85
,330,olebon-the-oloibon,"olebon the oloibon","Olebon is in a customized buba sokoto.",Male,"hair: bald;  eyes: closed teeth;  none skin: darkskin clothing;  animal print accessories: none expression;  surprised strength: empathy   weakness",de261efe-731d-461e-b2e4-42edd2f48f72,0434f76f6ac5d40248588630dab7f0594c2df27456865a3d4e47a4cf43528f62
,331,chifu-the-maasai,"chifu the maasai","Maasai shuka keeps bringing inspiration for new clothings. ",Male,"hair: bald;  eyes: closed teeth;  none skin: none clothing;  ankara shirt accessories: none expression;  visionary strength:  authentic weakness",239933c4-7177-4b5b-86e8-e6f952301344,1acacf9462a2e98ed363b073caa13e6162671aadf911c6f613167b5c9257b420
,332,mwangaa-the-voice,"mwangaa the voice","Mwangaa the chief is controlling but still loved as he has a calming voice.",Male,"hair:  bald;  eyes: blue teeth;  none skin: darkskin clothing;  white lined ankara accessories: none expression;  kindness strength:  brave weakness",49179b62-812d-4d0f-b518-4af7fa79f8bc,f321ea9b346977f8c55bda9de3b0d1b46f1055611bec2031fa0bb60f7b3cf812
,333,waforte-the-first,"waforte the first","Waforte loves to sleep and does nothing else.",Male,"hair: bald;  eyes: closedteeth; none skin: darkskin clothing;  jean ankara accessories: none expression;  shy strength:  weakness",871912a8-d96e-4594-b7b3-450d94ee6924,d00d25ea5d32445b502a816d7a2ae39c682621851319b69cb501a458f4ebdb46
,334,kariuki-the-prayerful-one,"kariuki the prayerful one","Kariuki closes his eyes as he watches the sunset.",Male,"hair: bald;  eyes: closed eyes teeth;  skin: clothing;  accessories: expression;  bored strength: intelligent  weakness",6a5b6fa6-0f91-4b01-957f-c766945eb704,fa6f55986d20c66b61fc577dac815f18a3a21f02c303b5a6660399aadfbec384
,335,kenyanese-the-priest,"kenyanese the priest","Kenyaanese is a masked up man with a white cloth as his signature attire. ",Male,"hair: bald;  eyes: white teeth;  none skin: darkskin clothing;  white jean shirt accessories: none expression;  calculative strength: kind weakness",0706c338-42eb-4d26-84ea-c24b39628200,fbb9176699056cc06fde53528610b9c80ebc4fd0210c14b9f84081aaf80892e7
,336,nyimbo-the-singer,"nyimbo the singer","Nimbo has his glasses on and a pot with hot porridge for the night",Female,"hair:dreadlocks;  eyes: glassed up teeth; none skin: brownskin clothing;  off shoulder ankara accessories: a pot expression;  free spirited strength: fair weakness",d05af807-b3e9-4ad3-8df1-b7864d2daa33,6ee3910798e969c37ca82ace2103255d10c965efe3e42400578311371f953dd9
,337,maathai-the-nobel-winner,"maathai the nobel winner","Mathaai the warrior is revered all over the land. ",Female,"hair: pink afro;  eyes: glassed up teeth;  none skin: brownskin clothing;  colored ankara accessories: noneexpression;  strict strength: leadership  weakness",0871cb8c-8d56-445d-92c7-01793f327707,a29298ab59108699ad640d39571e51306989b7f3de4b8f90f1ae03d4a6510751
,338,tish-the-angry-one,"tish the angry one","Tish is always angry and with specs on he looks really mean. ",Female,"hair: black huge afro;  eyes:  none teeth;  broken teeth skin: brownskin clothing;  offshoulder ankara accessories: none expression;  disgusted strength: blunt weakness",750a89dc-44ff-43bf-8211-b7776f1b5e52,316ffba42ff16704f7ca6cc96b84edca4f745ed24ebc3669f0186047c03396f3
,339,wamenza-the-winner,"wamenza the winner","Wamenza the leader has led his team to yet another thrillig victory. ",Female,"hair: laid back;  eyes: none teeth;  none skin: brownskin clothing;  offshoulder ankara accessories: noneexpression;  meditative strength: strict weakness",7348c9ed-4ac9-4785-9434-0a1f0dcaf8d8,8cbe644c687c5a59b8feab28bb732911f7b9a56c669ad884e3cc0dacae8d6f90
,340,isaya-the-track-king,"isaya the track king","Isaya the traveller has done a lot of travelling round Africa. ",Male,"hair: none eyes;  glassed up teeth: none skin;  brown skin clothing: bright ankara accessories;  none expression: taken aback strength;  straight forward weakness: selfish",41781a16-d2b8-4fc6-a1f4-b9fffc5c95ba,290f8d90ed822d3a7fb73be65ae5792850b3379ef19938fdb61466d73d50c32a
"TEAM RULER",341,mansur-the-partyrider,"mansur the partyrider","Mansur is the life of a party and never caught dulling.",Male,"hair: none;  eyes: ash grey;  teeth: none;   clothing: agbda;  accessories: studs;  expression:happy;  strength: intelligent;  weakness: red whine",78db0f29-3936-4d9c-bb90-3dbf20dba2dd,fbacffdc1968d7b04e6db16c7cfd6cac4db05620333a41bf62ee89037892cfa5
,342,tola-the-businessman,"tola the businessman","Tola loves business and owns several shops in Idumota.",Female,"hair: none;  eyes: midnightblack;  teeth: none;   clothing: purple blowse;  accessories: mask;  expression:furious;  strength: powerful;  weakness: love",1c5d5a6b-cf04-4bf9-978e-22a7e9bc5819,0df7518d9fcbca929a85740d55dae6d3f6128bdd6b527e90c2d5463e6e57ae8b
,343,abdullahi-the-honorable,"abdullahi the honorable","Popularly called ""buje budanu"" a godfather who lavishes money on young gees.",Male,"hair: none;  eyes: blue-blackish;  teeth: none;   clothing: yoruba attire;  accessories: none;  expression:anxious;  strength: foreseer;  weakness:indecision",dd708276-445f-4483-8357-fc08e999328f,5c1c4634297b5f9adfa2031ef39299edf1b23b88eaa73c1c95e16c64d27b53ca
,344,ojukwu-the-badguy,"ojukwu the badguy","Ojukwu is a business minded guy but fun to be with.",Male,"hair: bald;  eyes: eagle eyeball;  teeth: none;   clothing: yellow lining blowse;  accessories: none;  expression: none;  strength: good eyes for fashion;  weakness: lack will power",76c1eabf-15ea-446a-8426-472982c4d800,4d6ef4de61428aa2b005c4b4b83c600bc921dc9b3aacf3012dde32dcb5b71ea4
,345,odunsi-the-egbonadugbo,"odunsi the egbonadugbo","Odunsi loves to advise and people in the community rely on him.",Male,"hair: none;  eyes: dark brown;  teeth: none;  clothing: one shoulder gown;  accessories: none;  expression: none;  strength: elegant;  weakness: easily depressed",2912ab8b-5875-4277-a5c2-a0209aee90ae,64284aa1dc0ec233eaed8cae188b088aee442e85a8a1a068486959d97bbf0df1
,346,ogogo-the-sugardaddy,"ogogo the sugardaddy","A rich oil magnate who loves to solve young women's problems with his millions.",Male,"hair: none;  eyes: cat eyes;  teeth: none;  clothing: purple danshiki;  accessories:nose mask;  expression: straight face;  strength: brave ;  weakness: too selfless",aa575f30-04ad-45f9-a798-199465117793,5811ddabe97de0d0b16f90dc8cf9760ade6b08a9dff073716358a50d9d5d95aa
,347,suli-the-amalaseller,"suli the amalaseller","Suli sells amala with respect and people say that's the secret to her sweet food.",Female,"hair: low punk;  eyes: cat eyes;  teeth: none;  clothing:brown babarigai;  accessories:none;  expression: furious;  strength: wealthy;  weakness: too emotional",46fd4821-04dd-4f65-9290-c130a00c4c93,e5f6159cef07026af8a7ec281383217bf1cc3fb52bee86480d1e0bf88eedd4a2
,348,dolapo-the-afrocentric,"dolapo the afrocentric","Dolapo loves African prints and loves to showcase culture.",Female,"hair:bald;  eyes: brown;  teeth: none;  clothing: one sided blowse;  accessories: nose mask;  expression: none;  strength: beautiful;  weakness: forgetful",cbab232b-5c62-4df8-867b-018a2e496cd4,8097d34e3ac61cb3dc5cfdf0548bdff771294c3dd34eadd3e4248ac7716a15bb
,349,danjuma-the-saddist,danjuma-the-saddist,"Danjuma is a grumpy man no one likes to associate with him.",Male,"hair: none;  eyes: sky blue;  teeth: none;  clothing:purple agbada;  accessories: neck beads;  expression: excited;  strength: outspoken;  weakness: boring",5a42af57-186e-425b-b6b1-f72bda4911ef,1ddca20a35da55c3c848d3dccc699e33707d4cc57d1ec34e31a3b0d06b4609cd
,350,chinedu-the-farmer,"chinedu the farmer","A hardworking farmer who has 6 boys who help out on the farm.",Male,"hair: none;  eyes: black;  teeth: brown;  clothing: one sided gown;  accessories: none;  expression: blushy;  strength: easily loved;  weakness: get angry easily",9e8a55d7-0d8d-465d-a628-08ddd387a2c6,a655595ab5f78ad301b95ecc8278841a783c10a290f5933facd60ab1159d843b
,351,kola-the-baldguy,"kola the baldguy","Kola is every girls dream man because of his hair style.",Male,"hair: low cut;  eyes: mouse eyes;  teeth: none;  clothing: gbariye style;  accessories: nose mask;  expression: unhappy;  strength: good eyes for details;  weakness: sluggish",c32f1757-da9c-49e8-bd79-510a42b6971a,c2d17f5c8af50ba8c52ccb68490ef5cef1646560420a5f01bb6dcee3358d7b69
,352,bola-the-bosslady,"bola the bosslady","A lady who supports the boy child by providing scholarship to young talented males.",Female,"hair: low cut;  eyes: brown;  teeth: none;  clothing: short orange gown;  accessories: nose mask;  expression: none;  strength: industrious;  weaknes:spend lavishly",09ff910d-a2be-49d5-8b27-b9378458701c,92a828d34d45a038fb8553c1cb4977a22e74557a1793bd808974b5de378458ee
,353,kunle-the-alienguy,"kunle the alienguy","Kunle is special and easily get noticed even in the midst of crowd.",Male,"hair: green punk;  eyes: green;  teeth: none;  clothing: purple agbada;  accessories: purple beads;  expression: unbothered;  strength: very energetic;  weaknes:eaaily give in",dea2f5d8-e3ba-4d3f-9a17-0a7edfd0c100,dad781f426c322b6e400283917236b7d00d16b00e6d2e6c021479856efd648f9
,354,segun-the-sharp,"segun the sharp","Segun drives with caution and people love him for that.",Male,"hair: green punk;  eyes: black ;  teeth: none;  clothing: orange buba;  accessories: nose mask;  expression: bitchy;  strength: team player;  weaknes: none",f9159a9c-f48d-4aee-bcc1-63c86209f806,36d94fe52111271746949936a0bfe51847c1d1d49c1d97f839a2970fb6f4c1c8
,355,ola-the-hardguy,"ola the hardguy","Ola may be feared but he is such a coolheaded champ.",Male,"hair: none;  eyes: closed eyes;  teeth: none;  clothing: purple buba;  accessories: none;  expression: sick;  strength: quick recovery power;  weaknes: get ill frequently",a814fc77-bdfa-4e50-8ba8-3e4e4bcfb3c0,33ecfa0f5c1940c38281359d1eb53671f7a742c1901eb98245a6f5cf972dbdcd
,356,emeka-the-chief,"emeka the chief","Crowd are always at Emeka's house because of his selflessness.",Male,"hair: none;  eyes: closed eyes;  teeth: none;  clothing: pakaja attire;  accessories: none;  expression: bossing;  strength: easily comman respect;  weaknes: not a ladies man",195e89c8-0b6f-43ad-9a2c-d20f03439e96,2d7ae32af7f4efedbc5d928a01fcd1ec168de695f22fc99966373bfee4a1e30f
